{
  "schemaVersion": "1.0.0",
  "opaqueWorkerKey": "000000000000000000000000",
  "opaqueCandidateId": "111111111111111111111111",
  "absoluteWorktreePath": "C:\\Users\\rhenm\\Documents\\Codex\\2026-07-20\\template-worktree",
  "buildBranch": "template/build-branch",
  "baseBranch": "template/base-branch",
  "commonStartCommit": "0000000000000000000000000000000000000000",
  "commonStartTree": "0000000000000000000000000000000000000000",
  "promptSha256": "0000000000000000000000000000000000000000000000000000000000000000",
  "configSha256": "0000000000000000000000000000000000000000000000000000000000000000",
  "envelopeSchemaSha256": "0000000000000000000000000000000000000000000000000000000000000000"
}
